{
  "$schema": "/etc/xdg/swaync/configSchema.json",
  "positionX": "right",
  "positionY": "top",
  "control-center-margin-top": 0,
  "control-center-margin-bottom": 0,
  "control-center-margin-right": 0,
  "control-center-margin-left": 0,
  "notification-icon-size": 60,
  "notification-body-image-height": 100,
  "notification-body-image-width": 200,
  "timeout": 10,
  "timeout-low": 5,
  "timeout-critical": 0,
  "fit-to-screen": true,
  "control-center-width": 500,
  "control-center-height": 600,
  "notification-window-width": 500,
  "keyboard-shortcuts": true,
  "image-visibility": "when-available",
  "transition-time": 200,
  "hide-on-clear": false,
  "hide-on-action": true,
  "script-fail-notify": true,
  "scripts": {
    "example-script": {
      "exec": "echo 'Do something...'",
      "urgency": "Normal"
    }
  },
  "notification-visibility": {
    "example-name": {
      "state": "muted",
      "urgency": "Low",
      "app-name": "Spotify"
    }
  }
}

